{
  "eventId": "0192f701-0000-7000-8000-000000000004",
  "eventType": "GL_JOURNAL_POSTED",
  "eventVersion": 1,
  "occurredAt": "2026-10-10T09:41:05.118Z",
  "producer": "general-ledger-service",
  "aggregateType": "GlJournal",
  "aggregateId": "0192f700-0000-7000-8000-000000000001",
  "correlationId": "c-gl-mj-0001",
  "data": {
    "journalId": "0192f700-0000-7000-8000-000000000001",
    "journalRef": "GLJ-20261010-M-000001",
    "source": "MANUAL",
    "businessDate": "2026-10-10",
    "totalDebitPoisha": 57500,
    "totalCreditPoisha": 57500,
    "lineCount": 2,
    "reversesJournalId": null,
    "autoReverseOn": null,
    "makerId": "0192f0a1-0000-7000-8000-0000000000f1",
    "checkerIds": [
      "0192f0a1-0000-7000-8000-0000000000f2"
    ],
    "postedAt": "2026-10-10T09:41:05.100Z"
  }
}
