{
  "eventId": "0192fc7c-0000-7000-8000-00000000007c",
  "eventType": "PAYMENT_REQUEST_ACCEPTED",
  "eventVersion": 1,
  "occurredAt": "2026-10-09T10:00:00.140Z",
  "producer": "disbursement-service",
  "aggregateType": "PaymentRequest",
  "aggregateId": "0192fc33-0000-7000-8000-000000000003",
  "correlationId": "c-preq-0192fc33",
  "data": {
    "requestId": "0192fc33-0000-7000-8000-000000000003",
    "requestRef": "RQ261009P3X8K2NM",
    "requesterWalletId": "0192f2bb-0002-7000-8000-00000000b002",
    "payerWalletId": "0192f2aa-0001-7000-8000-00000000a001",
    "amountPoisha": 30000,
    "txnRef": "PP26100900T5Z9C1HQ"
  }
}