{
  "eventId": "0193a2d0-0000-7000-8000-0000000004e1",
  "eventType": "CASE_CLOSED",
  "eventVersion": 1,
  "occurredAt": "2026-10-12T07:00:00.020Z",
  "producer": "compliance-service",
  "aggregateType": "Case",
  "aggregateId": "0193a2d0-0000-7000-8000-000000000401",
  "correlationId": "c-7d21aa",
  "data": {
    "caseId": "0193a2d0-0000-7000-8000-000000000401",
    "caseNo": "CASE-2026-000123",
    "domain": "AML",
    "caseType": "AML_MONITORING",
    "subjectType": "CUSTOMER",
    "subjectId": "0192f2c0-0000-7000-8000-00000000c002",
    "walletId": "0192f2bb-4d5f-7c62-9b3e-6f1a4dac8b12",
    "decision": "SUSPICIOUS",
    "recommendedActions": [
      "FREEZE",
      "LIEN",
      "STR_DRAFT"
    ],
    "closedAt": "2026-10-12T07:00:00.000Z"
  }
}
