{
  "eventId": "0192f9a0-0000-7000-8000-000000000003",
  "eventType": "GL_PERIOD_STATUS_CHANGED",
  "eventVersion": 1,
  "occurredAt": "2026-11-03T06:12:40.517Z",
  "producer": "general-ledger-service",
  "aggregateType": "GlPeriod",
  "aggregateId": "2026-10",
  "correlationId": "c-gl-period-202610",
  "data": {
    "periodId": "2026-10",
    "periodKind": "MONTH",
    "fiscalYear": "FY2026-27",
    "fromDate": "2026-10-01",
    "toDate": "2026-10-31",
    "status": "CLOSED",
    "previousStatus": "OPEN",
    "netResultPoisha": 885,
    "closingJournalId": null,
    "makerId": "0192f0a1-0000-7000-8000-0000000000f1",
    "checkerIds": [
      "0192f0a1-0000-7000-8000-0000000000f2",
      "0192f0a1-0000-7000-8000-0000000000f3"
    ],
    "changedAt": "2026-11-03T06:12:40.500Z"
  }
}
