{
  "eventId": "0192f600-0000-7000-8000-000000000002",
  "eventType": "GL_DAY_CERTIFIED",
  "eventVersion": 1,
  "occurredAt": "2026-10-09T18:40:11.002Z",
  "producer": "general-ledger-service",
  "aggregateType": "GlDay",
  "aggregateId": "2026-10-09",
  "correlationId": "c-recon-tieout-20261009",
  "data": {
    "businessDate": "2026-10-09",
    "revision": 1,
    "certification": "CERTIFIED",
    "reconRunId": "0192f500-0a1b-7c2d-8e3f-4a5b6c7d8e01",
    "breakCount": 0,
    "certifiedAt": "2026-10-09T18:40:11.000Z"
  }
}
