{
  "eventId": "0192f3d2-1111-7000-8000-0000000000c5",
  "eventType": "KYC_TIER_CHANGED",
  "eventVersion": 1,
  "occurredAt": "2026-10-09T05:30:00.250Z",
  "producer": "wallet-service",
  "aggregateType": "Customer",
  "aggregateId": "0192f2a0-5b1c-7d10-8e11-0a1b2c3d4e01",
  "correlationId": "c-0f3e74",
  "data": {
    "customerId": "0192f2a0-5b1c-7d10-8e11-0a1b2c3d4e01",
    "walletIds": [
      "0192f2aa-1c3e-7b51-8a2d-5e0f3c9b7a01"
    ],
    "msisdn": "8801812000001",
    "nameEn": "Rahim Uddin",
    "nameBn": "রহিম উদ্দিন",
    "nidHash": "9f2c0e7a1b3d5f7091a2b3c4d5e6f708192a3b4c5d6e7f8091a2b3c4d5e6f708",
    "dob": "1990-04-12",
    "kycTier": 2,
    "riskGrade": "LOW",
    "occupation": "SALARIED",
    "incomeBand": "BDT_25K_50K",
    "division": "30",
    "district": "3026",
    "upazila": "302648",
    "union": null,
    "gender": "MALE",
    "language": "bn",
    "registeredAt": "2026-10-09T05:00:00.000Z",
    "registrationChannel": "PARTNER_APP",
    "kycExpiryDate": "2031-10-09",
    "referralCode": null,
    "reasonCode": "KYC_APPROVED",
    "submissionId": "0192f2c0-7a00-7000-8000-0000000000b1",
    "targetTier": null
  }
}
