{
  "eventId": "0192f3e1-2a3b-7c4d-8e5f-6a7b8c9d0e20",
  "eventType": "COMMISSION_ACCRUED",
  "eventVersion": 1,
  "occurredAt": "2026-10-03T05:12:09.411Z",
  "producer": "pricing-service",
  "aggregateType": "CommissionAccrual",
  "aggregateId": "0192f2c3-aaaa-7b10-9c00-0000000000a1",
  "correlationId": "c-5e1a07",
  "data": {
    "accrualId": "0192f3e1-2a3b-7c4d-8e5f-6a7b8c9d0e1f",
    "txnRef": "CO26100300Q8XK2M1D",
    "beneficiaryWalletId": "0192f2c3-aaaa-7b10-9c00-0000000000a1",
    "level": 1,
    "grossPoisha": 75,
    "aitPoisha": 8,
    "kind": "SHARE",
    "txnType": "CASH_OUT",
    "businessDate": "2026-10-03",
    "reversesAccrualId": null
  }
}
