{
  "eventId": "0193a2d0-0000-7000-8000-0000000004e3",
  "eventType": "REVERSAL_RECOMMENDED",
  "eventVersion": 1,
  "occurredAt": "2026-10-11T07:00:00.010Z",
  "producer": "compliance-service",
  "aggregateType": "ReversalRecommendation",
  "aggregateId": "0193a2d0-0000-7000-8000-000000000402",
  "correlationId": "c-7d21aa",
  "data": {
    "caseId": "0193a2d0-0000-7000-8000-000000000402",
    "caseNo": "CASE-2026-000124",
    "domain": "FRAUD",
    "txnRef": "PP26100900K3M9QX2A",
    "walletIds": [
      "0192f2aa-1c3e-7b51-8a2d-5e0f3c9b7a01",
      "0192f2bb-4d5f-7c62-9b3e-6f1a4dac8b12"
    ],
    "amountPoisha": 50000,
    "reasonCode": "FRAUD_CONFIRMED",
    "recommendedAt": "2026-10-11T07:00:00.000Z"
  }
}
