{
  "eventId": "0192fa77-0000-7000-8000-000000000077",
  "eventType": "BATCH_ROW_PAID",
  "eventVersion": 1,
  "occurredAt": "2026-10-09T10:04:11.231Z",
  "producer": "disbursement-service",
  "aggregateType": "DisbursementBatch",
  "aggregateId": "0192fa10-0000-7000-8000-000000000001",
  "correlationId": "c-batch-0192fa10",
  "data": {
    "batchId": "0192fa10-0000-7000-8000-000000000001",
    "rowNo": 42,
    "walletId": "0192f2bb-0002-7000-8000-00000000b002",
    "amountPoisha": 1250000,
    "commandId": "b767a223-29e4-5c21-a222-74e75e9ca80e",
    "payerWalletId": "0192f2ff-0006-7000-8000-00000000f006",
    "batchRef": "BD261009K7Q2M4ZD",
    "rowRef": "BD261009K7Q2M4ZD-42",
    "postedAt": "2026-10-09T10:04:11.102Z"
  }
}