{
  "eventId": "0192f6e0-0001-7c00-8a00-000000000001",
  "eventType": "REWARD_GRANTED",
  "eventVersion": 1,
  "occurredAt": "2026-11-05T09:12:00.140Z",
  "producer": "pricing-service",
  "aggregateType": "Reward",
  "aggregateId": "0192f2aa-1111-7c00-8a00-00000000c001",
  "correlationId": "c-91ab02",
  "data": {
    "campaignId": "0192f6c0-2a10-7b31-9c40-5a6b7c8d9e01",
    "walletId": "0192f2aa-1111-7c00-8a00-00000000c001",
    "rewardPoisha": 3500,
    "triggerTxnRef": "MP26110500K3M9QX2A",
    "commandId": "8dd991f0-a010-55ea-94f9-1e4f9c634f58",
    "rewardId": "0192f6d0-0001-7c00-8a00-000000000001",
    "rewardType": "CASHBACK",
    "beneficiaryRole": "SELF",
    "txnRef": "CR26110500J4Q8W2ZM"
  }
}
