{
  "eventId": "0192f104-1000-7000-8000-000000000e01",
  "eventType": "EMONEY_REDEEMED",
  "eventVersion": 1,
  "occurredAt": "2026-10-09T09:00:00.051Z",
  "producer": "treasury-service",
  "aggregateType": "EmoneyRedemption",
  "aggregateId": "0192f100-0000-7000-8000-000000000001",
  "correlationId": "c-7e2a01",
  "data": {
    "redemptionId": "0192f104-0000-7000-8000-000000000001",
    "txnRef": "ER2610090K3M9QX2AC",
    "trustAccountId": "0192f100-0000-7000-8000-000000000001",
    "ledgerTrustAccountId": "00000000-0000-0000-0000-000000030001",
    "bankCode": "BANK-020",
    "sourceType": "WALLET",
    "sourceAccountId": "0192f2dd-0000-7000-8000-00000000d001",
    "sourceAccountType": "DISTRIBUTOR_WALLET",
    "amountPoisha": 1000000,
    "reasonCode": "FLOAT_RETURN_TO_BANK",
    "bankReference": null,
    "makerId": "0192f0a1-0000-7000-8000-0000000000f1",
    "checkerIds": [
      "0192f0a1-0000-7000-8000-0000000000f2"
    ],
    "ledgerCommandId": "0192f104-0000-7000-8000-000000000001",
    "ledgerTransferIds": [
      "0d6e1f7a-2b3c-8d4e-9f50-61a7b8c9d0e1"
    ],
    "floatRequestId": "0192f201-0000-7000-8000-000000000009",
    "businessDate": "2026-10-09",
    "postedAt": "2026-10-09T09:00:00.000Z"
  }
}