{
  "eventId": "0192f600-0000-7000-8000-000000000001",
  "eventType": "GL_DAY_CLOSED",
  "eventVersion": 1,
  "occurredAt": "2026-10-09T18:16:02.341Z",
  "producer": "general-ledger-service",
  "aggregateType": "GlDay",
  "aggregateId": "2026-10-09",
  "correlationId": "c-gl-close-20261009",
  "data": {
    "businessDate": "2026-10-09",
    "revision": 1,
    "status": "CLOSED",
    "forced": false,
    "restated": false,
    "ruleSetVersion": 1,
    "ledgerJournalId": "0192f600-0000-7000-8000-00000000a001",
    "ledgerJournalRef": "GLJ-20261009-L-R1",
    "totalDebitPoisha": 110237509,
    "totalCreditPoisha": 110237509,
    "checks": {
      "journalBalanced": "PASS",
      "trialBalanceZero": "PASS",
      "ledgerControlTrust": "PASS",
      "ledgerControlSystem": "PASS",
      "summaryComplete": "PASS",
      "mustBeZero": "PASS",
      "ledgerControlledIntegrity": "PASS",
      "normalBalance": "PASS"
    },
    "exceptionCount": 0,
    "closedAt": "2026-10-09T18:16:02.300Z"
  }
}
