{
  "eventId": "0192f4a0-0000-7000-8000-0000000000e1",
  "eventType": "TRANSACTION_REVERSED",
  "eventVersion": 1,
  "occurredAt": "2026-10-09T09:30:00.040Z",
  "producer": "transaction-service",
  "aggregateType": "Transaction",
  "aggregateId": "0192f2aa-0001-7000-8000-00000000a001",
  "correlationId": "c-77aa01",
  "data": {
    "txnId": "0192f3c1-7a2b-7c00-9a51-3f2c8e1d0a11",
    "txnRef": "PP26100900K3M9QX2A",
    "txnType": "P2P",
    "status": "REVERSED",
    "channel": "APP",
    "initiatorActorType": "CUSTOMER",
    "initiatorActorId": "0192f1aa-0001-7000-8000-0000000000a1",
    "clientReference": "req-7f3a9c",
    "fromWalletId": "0192f2aa-0001-7000-8000-00000000a001",
    "fromWalletType": "C",
    "toWalletId": "0192f2bb-0002-7000-8000-00000000b002",
    "toWalletType": "C",
    "amountPoisha": 50000,
    "feePoisha": 500,
    "vatPoisha": 75,
    "feeBearer": "PAYER",
    "commissionPoisha": 0,
    "aitPoisha": 0,
    "commissionBeneficiaryWalletId": null,
    "pricingPlanId": "PLN-P2P-STD",
    "pricingPlanVersion": 3,
    "riskDecision": "ALLOW",
    "riskScore": 12,
    "deviceId": "d-123",
    "purposeCode": "FAMILY_SUPPORT",
    "note": null,
    "merchantReference": null,
    "qrPayloadId": null,
    "requestId": null,
    "reasonCode": null,
    "approvalId": null,
    "originalTxnRef": null,
    "failureCode": null,
    "ledgerTransferIds": [
      "fc214b7c-f80c-8143-4f0e-107e2518a302",
      "3c9f8cd0-5cc5-1049-aa02-80dfc5c61a13",
      "586bb84d-c6dc-fcd7-62fc-a264483349f4"
    ],
    "createdAt": "2026-10-09T08:03:22.101Z",
    "completedAt": "2026-10-09T08:03:22.161Z",
    "reversalTxnRef": "RV26100900Q2D5M8XT",
    "reverseFee": true,
    "reverseCommission": true,
    "reversedAmountPoisha": 50000,
    "refundedTotalPoisha": null
  }
}
