{
  "eventId": "0192fa79-0000-7000-8000-000000000079",
  "eventType": "BATCH_COMPLETED",
  "eventVersion": 1,
  "occurredAt": "2026-10-09T09:41:12.004Z",
  "producer": "disbursement-service",
  "aggregateType": "DisbursementBatch",
  "aggregateId": "0192fa10-0000-7000-8000-000000000001",
  "correlationId": "c-batch-0192fa10",
  "data": {
    "batchId": "0192fa10-0000-7000-8000-000000000001",
    "paidCount": 4990,
    "failedCount": 2,
    "paidPoisha": 6237500000,
    "status": "PARTIALLY_FAILED",
    "skippedCount": 0,
    "batchRef": "BD261009K7Q2M4ZD",
    "payerWalletId": "0192f2ff-0006-7000-8000-00000000f006",
    "completedAt": "2026-10-09T09:41:12.000Z",
    "completionSeq": 1
  }
}