{
  "eventId": "0192f400-1000-7000-8000-000000000e01",
  "eventType": "LIQUIDITY_THRESHOLD_BREACHED",
  "eventVersion": 1,
  "occurredAt": "2026-10-09T07:55:10.130Z",
  "producer": "treasury-service",
  "aggregateType": "FloatPosition",
  "aggregateId": "0192f2ee-0000-7000-8000-00000000e001",
  "correlationId": "c-7e2a01",
  "data": {
    "walletId": "0192f2ee-0000-7000-8000-00000000e001",
    "partnerId": "0192f2e0-0000-7000-8000-00000000e000",
    "partnerType": "AGENT",
    "subType": "RETAIL",
    "thresholdType": "LOW",
    "thresholdPoisha": 500000,
    "availableBalancePoisha": 450000,
    "parentWalletId": "0192f2dd-0000-7000-8000-00000000d001",
    "district": "3026",
    "incidentId": "0192f400-0000-7000-8000-000000000001",
    "realert": false,
    "detectedAt": "2026-10-09T07:55:10.120Z"
  }
}