{
  "eventId": "0192f400-6c1d-7e22-8a10-5b6c7d8e9f10",
  "eventType": "COMMISSION_SETTLED",
  "eventVersion": 1,
  "occurredAt": "2026-10-08T21:10:03.140Z",
  "producer": "pricing-service",
  "aggregateType": "CommissionSettlement",
  "aggregateId": "0192f2c3-aaaa-7b10-9c00-0000000000a1",
  "correlationId": "job-settlement-2026-10-08",
  "data": {
    "settlementId": "0192f400-6c1d-7e22-8a10-5b6c7d8e9f00",
    "beneficiaryWalletId": "0192f2c3-aaaa-7b10-9c00-0000000000a1",
    "period": "2026-10-01/2026-10-07",
    "grossPoisha": 4520,
    "aitPoisha": 452,
    "netPoisha": 4068,
    "ledgerCommandId": "0192f400-6c1d-7e22-8a10-5b6c7d8e9f00",
    "txnRef": "CMS-20261007-K3M9QX2A",
    "accrualCount": 37
  }
}
