{
  "eventId": "0192f103-1000-7000-8000-000000000e01",
  "eventType": "EMONEY_ISSUED",
  "eventVersion": 1,
  "occurredAt": "2026-10-09T08:10:00.045Z",
  "producer": "treasury-service",
  "aggregateType": "EmoneyIssuance",
  "aggregateId": "0192f100-0000-7000-8000-000000000001",
  "correlationId": "c-7e2a01",
  "data": {
    "issuanceId": "0192f103-0000-7000-8000-000000000001",
    "txnRef": "EI2610090K3M9QX2AB",
    "trustAccountId": "0192f100-0000-7000-8000-000000000001",
    "ledgerTrustAccountId": "00000000-0000-0000-0000-000000030001",
    "bankCode": "BANK-020",
    "destinationType": "WALLET",
    "destinationAccountId": "0192f2dd-0000-7000-8000-00000000d001",
    "destinationWalletType": "D",
    "amountPoisha": 50000000,
    "bankReference": "DEP-20261009-000123",
    "makerId": "0192f0a1-0000-7000-8000-0000000000f1",
    "checkerIds": [
      "0192f0a1-0000-7000-8000-0000000000f2",
      "0192f0a1-0000-7000-8000-0000000000f3"
    ],
    "ledgerCommandId": "0192f103-0000-7000-8000-000000000001",
    "ledgerTransferIds": [
      "5e3a9c10-2b7d-4f61-8a0e-3c2d1b0a9f87"
    ],
    "floatRequestId": null,
    "businessDate": "2026-10-09",
    "postedAt": "2026-10-09T08:10:00.000Z"
  }
}