{
  "eventId": "0192f8a0-0001-7c00-8a00-000000000002",
  "eventType": "REWARD_CLAWED_BACK",
  "eventVersion": 1,
  "occurredAt": "2026-11-12T03:40:10.512Z",
  "producer": "pricing-service",
  "aggregateType": "Reward",
  "aggregateId": "0192f2aa-1111-7c00-8a00-00000000c001",
  "correlationId": "c-7a10fe",
  "data": {
    "campaignId": "0192f6c0-2a10-7b31-9c40-5a6b7c8d9e01",
    "walletId": "0192f2aa-1111-7c00-8a00-00000000c001",
    "rewardPoisha": 3500,
    "triggerTxnRef": "MP26110500K3M9QX2A",
    "commandId": "8dd991f0-a010-55ea-94f9-1e4f9c634f58",
    "clawbackCommandId": "ea1271e7-d0be-589d-b65e-d32e6adeed45",
    "reasonCode": "TRANSACTION_REVERSED",
    "clawbackMode": "LEDGER_REVERSAL",
    "clawbackTxnRef": "CC26111200P2M7X4QA"
  }
}
